<?xml version="1.0" encoding="utf-8"?>

<impostazioni xmlns:xsi="http://www.w3.org/2001/XMLSchema-instance" 
         xsi:noNamespaceSchemaLocation="Impostazioni.xsd">

	<impostazione>
		<volumeMusica>50.0</volumeMusica>
		<enableMusica>true</enableMusica>
		<effettiAudio>50.0</effettiAudio>
		<enableEffetti>true</enableEffetti>
		<lingua>it-IT</lingua>
	</impostazione>
	<primoAvvio>true</primoAvvio>
	<primoAccesso>true</primoAccesso>
	
</impostazioni>